{
  "version": 1,
  "slot": 1,
  "profile": {
    "name": "Alex",
    "dorm": "Slifer",
    "title": "Apprentice Duelist",
    "dp": 3000,
    "gender": "unspecified",
    "playtime_seconds": 0,
    "temporary_title": "",
    "temporary_title_days": 0,
    "initialized": true
  },
  "calendar": {
    "year": 1,
    "month": 10,
    "month_index": 0,
    "day": 7,
    "period": "AM",
    "weekday": "Saturday",
    "hour": 8
  },
  "flags": {
    "registered": true,
    "met_jaden": true,
    "first_free_roam": true,
    "event_01_cleared": true
  },
  "counters": {
    "wins_total": 0,
    "wins_jaden": 0,
    "timed_clears": 0,
    "written_correct": 0
  },
  "inventory": {
    "40": 3,
    "117": 3,
    "148": 3,
    "190": 3,
    "221": 3,
    "251": 3,
    "261": 3,
    "280": 3,
    "318": 3,
    "319": 3,
    "368": 3,
    "380": 3,
    "381": 3,
    "389": 3,
    "397": 3,
    "402": 3,
    "425": 3,
    "437": 3,
    "444": 3,
    "475": 3,
    "482": 3,
    "483": 3,
    "485": 3,
    "580": 3,
    "621": 3,
    "702": 3,
    "766": 3,
    "826": 3,
    "841": 3,
    "843": 3,
    "862": 3,
    "892": 3,
    "894": 3,
    "956": 3,
    "983": 3,
    "1003": 3,
    "1009": 3,
    "1065": 3,
    "1192": 3
  },
  "decks": [
    {
      "id": "player_1",
      "name": "My Deck",
      "main": [
        40,
        117,
        148,
        190,
        221,
        251,
        261,
        280,
        318,
        368,
        380,
        381,
        389,
        397,
        402,
        425,
        437,
        444,
        475,
        482,
        483,
        483,
        485,
        580,
        621,
        702,
        766,
        826,
        841,
        843,
        862,
        892,
        892,
        894,
        956,
        983,
        1003,
        1009,
        1065,
        1192
      ],
      "extra": [
        319
      ]
    }
  ],
  "events": {
    "E01": "complete",
    "E01b": "complete",
    "FJ01": "available"
  },
  "exams": [],
  "emails": {
    "jaden": {
      "unlocked": true,
      "read": [
        "jaden_01"
      ]
    }
  },
  "settings": {
    "animation_speed": 2,
    "confirm_activation": true
  },
  "story": null,
  "meta": {
    "name": "Alex",
    "title": "Apprentice Duelist",
    "dorm": "Slifer",
    "dp": 3000,
    "playtime_seconds": 0,
    "year": 1,
    "month": 10,
    "month_index": 0,
    "day": 7,
    "period": "AM",
    "saved_at": "2026-10-30T00:00:00Z",
    "build": "baseline-b4d8bb0"
  },
  "slot_name": "Slot 1",
  "saved_at": "2026-10-30T00:00:00Z"
}
